[
  { "schema_version": "notepad_op.v1", "op_id": "a1b2c3d4-e5f6-4a7b-8c9d-0e1f2a3b4c5d", "op": "append", "spec_id": "agent-notepad", "task_id": "notepad-01-service-core", "path": "thought-log.md", "region": "agent_append", "content": "Chose an in-memory backend for golden tasks." },
  { "schema_version": "notepad_op.v1", "op_id": "b1b2c3d4-e5f6-4a7b-8c9d-0e1f2a3b4c5d", "op": "write", "spec_id": "agent-notepad", "task_id": "notepad-01-service-core", "path": "questions/q-001.md", "region": "human", "content": "Answer: keep one bucket per project for now." },
  { "schema_version": "notepad_op.v1", "op_id": "c1b2c3d4-e5f6-4a7b-8c9d-0e1f2a3b4c5d", "op": "transition", "spec_id": "agent-notepad", "task_id": "notepad-01-service-core", "path": "questions/q-001.md", "transition": { "block_id": "q-001", "to": "accepted" } },
  { "schema_version": "notepad_op.v1", "op_id": "d1b2c3d4-e5f6-4a7b-8c9d-0e1f2a3b4c5d", "op": "record_tool_output", "spec_id": "agent-notepad", "task_id": "notepad-01-service-core", "path": "tools/rig-scan.json", "region": "tool_output", "content": "{\"findings\":[]}", "tool": { "name": "rig", "version": "0.4.0", "image_digest": "sha256:5d5d5d5d5d5d5d5d5d5d5d5d5d5d5d5d5d5d5d5d5d5d5d5d5d5d5d5d5d5d5d5d", "inputs_sha256": "sha256:6e6e6e6e6e6e6e6e6e6e6e6e6e6e6e6e6e6e6e6e6e6e6e6e6e6e6e6e6e6e6e6e" } },
  { "schema_version": "notepad_op.v1", "op_id": "e1b2c3d4-e5f6-4a7b-8c9d-0e1f2a3b4c5d", "op": "place_input", "spec_id": "agent-notepad", "task_id": "notepad-01-service-core", "path": "inputs/spec.json", "region": "inputs", "input": { "kind": "spec", "object": { "uri": "s3://drecoder-factory-specs/agent-notepad/v3.json", "sha256": "sha256:7f7f7f7f7f7f7f7f7f7f7f7f7f7f7f7f7f7f7f7f7f7f7f7f7f7f7f7f7f7f7f7f", "size_bytes": 4096, "media_type": "application/json" } } },
  { "schema_version": "notepad_op.v1", "op_id": "f1b2c3d4-e5f6-4a7b-8c9d-0e1f2a3b4c5d", "op": "read", "spec_id": "agent-notepad", "task_id": "notepad-01-service-core", "path": "thought-log.md", "version": 1 },
  { "schema_version": "notepad_op.v1", "op_id": "a2b2c3d4-e5f6-4a7b-8c9d-0e1f2a3b4c5d", "op": "list", "spec_id": "agent-notepad", "task_id": "notepad-01-service-core" },
  { "schema_version": "notepad_op.v1", "op_id": "a3b2c3d4-e5f6-4a7b-8c9d-0e1f2a3b4c5d", "op": "seal", "spec_id": "agent-notepad", "task_id": "notepad-01-service-core" },
  { "schema_version": "notepad_op.v1", "op_id": "a4b2c3d4-e5f6-4a7b-8c9d-0e1f2a3b4c5d", "op": "lease_acquire", "spec_id": "agent-notepad", "task_id": "notepad-01-service-core", "lease": { "branch": "feat/notepad-core", "ttl_seconds": 900 } }
]
